{
  "schemaVersion": 1,
  "recordType": "status",
  "rulesetVersion": "1.0.0",
  "recordRevision": 1,
  "owner": {
    "accountId": "1001",
    "profileRepositoryId": "9001"
  },
  "lastSuccessfulRevision": 1,
  "state": "ok",
  "reasonCode": null,
  "changedAt": "2026-10-16T00:10:00Z",
  "collectionPending": [],
  "unobservedGaps": []
}
